{
  "section": "s09",
  "title": "Mathematical and Relativistic Foundations for Anomalous Flight",
  "last_updated": "2026-03-26",
  "data_note": "This section is currently formula-centric. It defines theoretical invariants and dimensionless control parameters rather than standalone quantitative claims, so the statistics array is intentionally empty until future empirical constraints are added.",
  "statistics": []
}
